{
  "schema_version": 1,
  "catalog_id": "zeroth-published-product-v1",
  "sources": {
    "ambiguous-operation-resolution-ui-accepted-20260826-1": {
      "campaign": "evaluation-studio-v1",
      "bucket": "evidence",
      "root": "ambiguous-operation-resolution-ui-accepted-20260826-1",
      "record": "acceptance.json",
      "record_kind": "acceptance"
    },
    "provider-independent-surface-closure-accepted-20260826-1": {
      "campaign": "evaluation-studio-v1",
      "bucket": "evidence",
      "root": "provider-independent-surface-closure-accepted-20260826-1",
      "record": "acceptance.json",
      "record_kind": "acceptance"
    },
    "provider-independent-ui-runs-live-accepted-20260826-1": {
      "campaign": "evaluation-studio-v1",
      "bucket": "evidence",
      "root": "provider-independent-ui-runs-live-accepted-20260826-1",
      "record": "acceptance.json",
      "record_kind": "acceptance"
    },
    "audit-broken-chain-checkpoint-20260825-2": {
      "campaign": "evaluation-studio-v1",
      "bucket": "evidence",
      "root": "audit-broken-chain-checkpoint-20260825-2",
      "record": "acceptance.json",
      "record_kind": "acceptance"
    },
    "batch-negative-recovery-accepted-20260826-2": {
      "campaign": "evaluation-studio-v1",
      "bucket": "evidence",
      "root": "batch-negative-recovery-accepted-20260826-2",
      "record": "acceptance.json",
      "record_kind": "acceptance"
    },
    "chroma-corpus-checkpoint-20260824-2": {
      "campaign": "evaluation-studio-v1",
      "bucket": "evidence",
      "root": "chroma-corpus-checkpoint-20260824-2",
      "record": "acceptance.json",
      "record_kind": "acceptance"
    },
    "composed-execution-backend-20260825-1": {
      "campaign": "evaluation-studio-v1",
      "bucket": "evidence",
      "root": "composed-execution-backend-20260825-1",
      "record": "acceptance.json",
      "record_kind": "acceptance"
    },
    "governance-enforcement-live-services-20260825-2": {
      "campaign": "evaluation-studio-v1",
      "bucket": "evidence",
      "root": "governance-enforcement-live-services-20260825-2",
      "record": "acceptance.json",
      "record_kind": "acceptance"
    },
    "identity-isolation-live-checkpoint-20260825-1": {
      "campaign": "evaluation-studio-v1",
      "bucket": "evidence",
      "root": "identity-isolation-live-checkpoint-20260825-1",
      "record": "acceptance.json",
      "record_kind": "acceptance"
    },
    "loops-code-runtime-checkpoint-20260825-3": {
      "campaign": "evaluation-studio-v1",
      "bucket": "evidence",
      "root": "loops-code-runtime-checkpoint-20260825-3",
      "record": "acceptance.json",
      "record_kind": "acceptance"
    },
    "loops-code-ui-checkpoint-20260825-3": {
      "campaign": "evaluation-studio-v1",
      "bucket": "evidence",
      "root": "loops-code-ui-checkpoint-20260825-3",
      "record": "acceptance.json",
      "record_kind": "acceptance"
    },
    "native-safari-context-threads-20260825-1": {
      "campaign": "evaluation-studio-v1",
      "bucket": "evidence",
      "root": "native-safari-context-threads-20260825-1",
      "record": "acceptance.json",
      "record_kind": "acceptance"
    },
    "native-safari-loop-refresh-checkpoint-20260825-1": {
      "campaign": "evaluation-studio-v1",
      "bucket": "evidence",
      "root": "native-safari-loop-refresh-checkpoint-20260825-1",
      "record": "acceptance.json",
      "record_kind": "acceptance"
    },
    "native-safari-operator-denial-checkpoint-20260825-1": {
      "campaign": "evaluation-studio-v1",
      "bucket": "evidence",
      "root": "native-safari-operator-denial-checkpoint-20260825-1",
      "record": "acceptance.json",
      "record_kind": "acceptance"
    },
    "native-safari-retention-validation-checkpoint-20260825-1": {
      "campaign": "evaluation-studio-v1",
      "bucket": "evidence",
      "root": "native-safari-retention-validation-checkpoint-20260825-1",
      "record": "acceptance.json",
      "record_kind": "acceptance"
    },
    "native-safari-webhook-worker-audits-20260825-1": {
      "campaign": "evaluation-studio-v1-retention-disposable",
      "bucket": "evidence",
      "root": "native-safari-webhook-worker-audits-20260825-1",
      "record": "results.json",
      "record_kind": "completed_results"
    },
    "native-safari-webhooks-20260825-1": {
      "campaign": "evaluation-studio-v1-retention-disposable",
      "bucket": "evidence",
      "root": "native-safari-webhooks-20260825-1",
      "record": "results.json",
      "record_kind": "completed_results"
    },
    "product-surface-inventory-deep-accepted-20260826-1": {
      "campaign": "evaluation-studio-v1",
      "bucket": "evidence",
      "root": "product-surface-inventory-deep-accepted-20260826-1",
      "record": "acceptance.json",
      "record_kind": "acceptance"
    },
    "resilient-http-dual-browser-accepted-20260826-1": {
      "campaign": "evaluation-studio-v1",
      "bucket": "evidence",
      "root": "resilient-http-dual-browser-accepted-20260826-1",
      "record": "acceptance.json",
      "record_kind": "acceptance"
    },
    "retention-compliance-live-checkpoint-20260825-1": {
      "campaign": "evaluation-studio-v1",
      "bucket": "evidence",
      "root": "retention-compliance-live-checkpoint-20260825-1",
      "record": "acceptance.json",
      "record_kind": "acceptance"
    },
    "retention-dedicated-checkpoint-20260825-1": {
      "campaign": "evaluation-studio-v1",
      "bucket": "evidence",
      "root": "retention-dedicated-checkpoint-20260825-1",
      "record": "acceptance.json",
      "record_kind": "acceptance"
    },
    "retention-held-refusal-current-accepted-20260826-1": {
      "campaign": "evaluation-studio-v1",
      "bucket": "evidence",
      "root": "retention-held-refusal-current-accepted-20260826-1",
      "record": "acceptance.json",
      "record_kind": "acceptance"
    },
    "retention-erasure-evidence-repair-accepted-20260826-1": {
      "campaign": "evaluation-studio-v1",
      "bucket": "evidence",
      "root": "retention-erasure-evidence-repair-accepted-20260826-1",
      "record": "acceptance.json",
      "record_kind": "acceptance"
    },
    "economics-provider-independent-ui-20260826-1": {
      "campaign": "evaluation-studio-v1",
      "bucket": "evidence",
      "root": "economics-provider-independent-ui-20260826-1",
      "record": "acceptance.json",
      "record_kind": "acceptance"
    },
    "governance-economics-evidence-repair-accepted-20260826-1": {
      "campaign": "evaluation-studio-v1",
      "bucket": "evidence",
      "root": "governance-economics-evidence-repair-accepted-20260826-1",
      "record": "acceptance.json",
      "record_kind": "acceptance"
    },
    "templates-artifacts-product-exact-20260826-2": {
      "campaign": "evaluation-studio-v1",
      "bucket": "evidence",
      "root": "templates-artifacts-product-exact-20260826-2",
      "record": "acceptance.json",
      "record_kind": "acceptance"
    },
    "rightsizing-deterministic-ui-20260825-6": {
      "campaign": "evaluation-studio-v1",
      "bucket": "evidence",
      "root": "rightsizing-deterministic-ui-20260825-6",
      "record": "acceptance.json",
      "record_kind": "acceptance"
    },
    "rightsizing-deterministic-ui-20260825-8": {
      "campaign": "evaluation-studio-v1",
      "bucket": "evidence",
      "root": "rightsizing-deterministic-ui-20260825-8",
      "record": "acceptance.json",
      "record_kind": "acceptance"
    },
    "studio-if-shortcut-ui-checkpoint-20260826-1": {
      "campaign": "evaluation-studio-v1",
      "bucket": "evidence",
      "root": "studio-if-shortcut-ui-checkpoint-20260826-1",
      "record": "acceptance.json",
      "record_kind": "acceptance"
    },
    "studio-live-authoring-checkpoint-20260824-1": {
      "campaign": "evaluation-studio-v1",
      "bucket": "evidence",
      "root": "studio-live-authoring-checkpoint-20260824-1",
      "record": "acceptance.json",
      "record_kind": "acceptance"
    },
    "subgraph-validation-checkpoint-20260825-1": {
      "campaign": "evaluation-studio-v1",
      "bucket": "evidence",
      "root": "subgraph-validation-checkpoint-20260825-1",
      "record": "acceptance.json",
      "record_kind": "acceptance"
    },
    "templates-provider-independent-gate-20260825-1": {
      "campaign": "evaluation-studio-v1",
      "bucket": "evidence",
      "root": "templates-provider-independent-gate-20260825-1",
      "record": "acceptance.json",
      "record_kind": "acceptance"
    },
    "webhook-restart-recovery-live-20260825-1": {
      "campaign": "evaluation-studio-v1-retention-disposable",
      "bucket": "evidence",
      "root": "webhook-restart-recovery-live-20260825-1",
      "record": "acceptance.json",
      "record_kind": "acceptance"
    },
    "webhook-atomicity-product-ids-accepted-20260826-1": {
      "campaign": "evaluation-studio-v1",
      "bucket": "evidence",
      "root": "webhook-atomicity-product-ids-accepted-20260826-1",
      "record": "acceptance.json",
      "record_kind": "acceptance"
    },
    "webhooks-exact-supersession-accepted-20260826-1": {
      "campaign": "evaluation-studio-v1",
      "bucket": "evidence",
      "root": "webhooks-exact-supersession-accepted-20260826-1",
      "record": "acceptance.json",
      "record_kind": "acceptance"
    },
    "workflow1-chroma-unavailable-checkpoint-20260824-2": {
      "campaign": "evaluation-studio-v1",
      "bucket": "evidence",
      "root": "workflow1-chroma-unavailable-checkpoint-20260824-2",
      "record": "acceptance.json",
      "record_kind": "acceptance"
    },
    "workflow2-child-pause-accepted-20260826-1": {
      "campaign": "evaluation-studio-v1",
      "bucket": "evidence",
      "root": "workflow2-child-pause-accepted-20260826-1",
      "record": "acceptance.json",
      "record_kind": "acceptance"
    },
    "workflow2-retrieval-miss-accepted-20260826-1": {